{
  "template_id": "niagara.emitter.sparks.v1",
  "domain": "niagara",
  "category": "emitter_archetype",
  "version": 1,
  "description": "Spark burst emitter archetype for projectiles and impacts.",
  "purpose": "High-frequency spark read; maps to Firebolt Sparks1 emitter role.",
  "authored_by": "human",
  "engine_compatibility": {
    "min_version": "5.8.0",
    "verified_on": ["5.8.0"]
  },
  "inputs": {
    "type": "object",
    "properties": {
      "color": { "type": "array", "items": { "type": "number" }, "minItems": 4, "maxItems": 4 },
      "scale": { "type": "number", "minimum": 0 },
      "velocity": { "type": "number", "minimum": 0 }
    },
    "required": ["color", "scale", "velocity"]
  },
  "required_components": ["sparks_emitter"],
  "supported_modifiers": ["increase_spark_count", "reduce_velocity"],
  "construction_plan": [
    {
      "id": "emitter",
      "action": "create_niagara_effect",
      "specification": {
        "effect_type": "emitter_archetype",
        "archetype_role": "sparks",
        "emitter_template_path": "/Niagara/DefaultAssets/Templates/Emitters/SimpleSpriteBurst/SimpleSpriteBurstEmitter",
        "parameters": {
          "primary_color": [1.0, 0.8, 0.2, 1.0],
          "scale": 1.0,
          "velocity": 400.0
        }
      }
    }
  ],
  "validation_rules": [
    {
      "rule_id": "sparks_burst",
      "check": "spawn_rate > 0",
      "severity": "error",
      "message": "Sparks archetype must spawn visible particles."
    }
  ],
  "typical_ranges": {
    "velocity": { "min": 100.0, "max": 1200.0, "typical": 400.0 }
  },
  "search_terms": ["sparks", "burst", "projectile", "impact"]
}
