{"template_id":"niagara.emitter.impact_burst.v1","domain":"niagara","category":"emitter_archetype","version":1,"description":"Omnidirectional impact burst emitter archetype.","purpose":"Hit-stop burst read; maps to Firebolt Flash / impact roles.","authored_by":"human","engine_compatibility":{"min_version":"5.8.0","verified_on":["5.8.0"]},"inputs":{"type":"object","properties":{"color":{"type":"array","items":{"type":"number"},"minItems":4,"maxItems":4},"scale":{"type":"number","minimum":0},"intensity":{"type":"number","minimum":0}},"required":["color","scale","intensity"]},"required_components":["impact_emitter"],"supported_modifiers":["boost_impact","add_ground_decal"],"construction_plan":[{"id":"emitter","action":"create_niagara_effect","specification":{"effect_type":"emitter_archetype","archetype_role":"impact_burst","emitter_template_path":"/Niagara/DefaultAssets/Templates/Emitters/OmnidirectionalBurst/OmnidirectionalBurstEmitter","parameters":{"primary_color":[1.0,0.6,0.1,1.0],"scale":1.0,"intensity":10.0}}}],"validation_rules":[{"rule_id":"burst_one_shot","check":"loop_behavior == 'once'","severity":"warning","message":"Impact burst should be one-shot, not looping."}],"typical_ranges":{"intensity":{"min":2.0,"max":30.0,"typical":10.0}},"search_terms":["impact","burst","omnidirectional","hit","explosion"]}
