{"template_id":"niagara.emitter.ribbon_trail.v1","domain":"niagara","category":"emitter_archetype","version":1,"description":"Location-based ribbon trail emitter archetype.","purpose":"Motion trail read; maps to Firebolt Trail emitter role.","authored_by":"human","engine_compatibility":{"min_version":"5.8.0","verified_on":["5.8.0"]},"inputs":{"type":"object","properties":{"color":{"type":"array","items":{"type":"number"},"minItems":4,"maxItems":4},"scale":{"type":"number","minimum":0}},"required":["color","scale"]},"required_components":["ribbon_emitter","ribbon_renderer"],"supported_modifiers":["reduce_trail_persistence","widen_ribbon"],"construction_plan":[{"id":"emitter","action":"create_niagara_effect","specification":{"effect_type":"emitter_archetype","archetype_role":"ribbon_trail","emitter_template_path":"/Niagara/DefaultAssets/Templates/Emitters/LocationBasedRibbon/LocationBasedRibbonEmitter","parameters":{"primary_color":[1.0,0.4,0.05,0.8],"scale":1.0}}}],"validation_rules":[{"rule_id":"ribbon_renderer","check":"has_renderer('Ribbon')","severity":"error","message":"Ribbon trail archetype requires a ribbon renderer."}],"typical_ranges":{"scale":{"min":0.25,"max":2.0,"typical":1.0}},"search_terms":["ribbon","trail","location based","projectile"]}
